{"actions":[],"canonical_profile":"schuss-canonical-json-v1","content_hash":"sha256:c50d7675ae509af58d028b69d1bc6bf6a85d133111a4f911d12a31fefa6a8ee1","device_feedback_mappings":[],"device_input_mappings":[],"device_profile_reference":{"content_hash":"sha256:26883806207677ec61e2a409c43a0e90f55800dc8a28e52bc75557efeee60338","device_profile_id":"schuss-device-profile-000001","revision":2},"display_name":"Task 032 reference variable host fixture","displays":[],"graph_mappings":[{"destination":{"facet_id":"graph-facet-000001","facet_kind":"parameter"},"destination_domain":{"maximum":"1","minimum":"0","unit":"normalized"},"direction":"instrument-to-graph","mapping_id":"graph-mapping-000001","mapping_kind":"parameter-to-parameter","source":{"facet_id":"instrument-parameter-000001","facet_kind":"parameter"},"source_domain":{"maximum":"1","minimum":"0","unit":"normalized"},"transform":{"curve":"linear","points":[{"destination":"0","source":"0"},{"destination":"1","source":"1"}],"polarity":"direct"}},{"destination":{"facet_id":"graph-facet-000002","facet_kind":"parameter"},"destination_domain":{"maximum":"1","minimum":"0","unit":"normalized"},"direction":"instrument-to-graph","mapping_id":"graph-mapping-000002","mapping_kind":"parameter-to-parameter","source":{"facet_id":"instrument-parameter-000002","facet_kind":"parameter"},"source_domain":{"maximum":"1","minimum":"0","unit":"normalized"},"transform":{"curve":"linear","points":[{"destination":"0","source":"0"},{"destination":"1","source":"1"}],"polarity":"direct"}}],"graph_reference":{"content_hash":"sha256:0431ce3c72f51ef74755e18b1c789f0081326b41f7c167b92630a7a2246ce0f7","graph_id":"schuss-graph-508458","revision":1,"status":"resolved"},"instrument_id":"schuss-instrument-289694","parameters":[{"default":"0.5","display_label":"Blend","domain":{"maximum":"1","minimum":"0","unit":"normalized"},"facet_id":"instrument-parameter-000002","update_behavior":{"smoothing_responsibility":"graph","stateful":true,"update_kind":"runtime"},"value_type":"exact-decimal"},{"default":"0.5","display_label":"Motion","domain":{"maximum":"1","minimum":"0","unit":"normalized"},"facet_id":"instrument-parameter-000001","update_behavior":{"smoothing_responsibility":"graph","stateful":true,"update_kind":"runtime"},"value_type":"exact-decimal"}],"revision":1,"schema_version":"instrument-v0","state_declarations":[{"display_label":"Performance State","persistence":"volatile","reset_policy":"default-on-start","state_id":"instrument-state-000001","value_kind":"boolean"}]}
