{"actions":[{"display_label":"Reset Blend Control","facet_id":"instrument-action-000001","payload_kind":"none"}],"canonical_profile":"schuss-canonical-json-v1","content_hash":"sha256:6b41e740ba7c4d098733d0f8fe462166ae553894b01c86a5db579d9aff38fc85","device_feedback_mappings":[{"destination":{"slot_id":"device-feedback-000001","slot_kind":"feedback-output"},"direction":"instrument-to-device","mapping_id":"feedback-mapping-000001","source":{"facet_id":"instrument-state-000001","facet_kind":"state"},"update_responsibility":"instrument"},{"destination":{"slot_id":"device-display-000001","slot_kind":"display"},"direction":"instrument-to-device","mapping_id":"feedback-mapping-000002","source":{"facet_id":"instrument-display-000001","facet_kind":"display"},"update_responsibility":"instrument"}],"device_input_mappings":[{"destination":{"facet_id":"instrument-parameter-000001","facet_kind":"parameter"},"destination_domain":{"maximum":"1","minimum":"0","unit":"normalized"},"direction":"device-to-instrument","mapping_id":"device-mapping-000001","mapping_kind":"parameter-control","pickup":{"mode":"soft","responsibility":"instrument"},"response":{"response_time":"control-update","smoothing_responsibility":"instrument"},"source":{"facet_kind":"input-control","slot_id":"device-input-000001"},"source_domain":{"maximum":"1","minimum":"0","unit":"normalized"},"transform":{"curve":"linear","points":[{"destination":"0","source":"0"},{"destination":"1","source":"1"}],"polarity":"direct"}},{"destination":{"facet_id":"instrument-action-000001","facet_kind":"action"},"direction":"device-to-instrument","mapping_id":"device-mapping-000002","mapping_kind":"action-trigger","source":{"facet_kind":"gesture","gesture_id":"device-gesture-000001"}}],"device_profile_reference":{"content_hash":"sha256:26883806207677ec61e2a409c43a0e90f55800dc8a28e52bc75557efeee60338","device_profile_id":"schuss-device-profile-000001","revision":2},"display_name":"Four-step dual-sine full-panel mapped instrument","displays":[{"access":"read-only","display_label":"Blend Value","facet_id":"instrument-display-000001","value_kind":"exact-decimal"}],"graph_mappings":[{"destination":{"facet_id":"graph-facet-000001","facet_kind":"parameter"},"destination_domain":{"maximum":"1","minimum":"0","unit":"normalized"},"direction":"instrument-to-graph","mapping_id":"graph-mapping-000001","mapping_kind":"parameter-to-parameter","source":{"facet_id":"instrument-parameter-000001","facet_kind":"parameter"},"source_domain":{"maximum":"1","minimum":"0","unit":"normalized"},"transform":{"curve":"linear","points":[{"destination":"0","source":"0"},{"destination":"1","source":"1"}],"polarity":"direct"}}],"graph_reference":{"content_hash":"sha256:ea98b4cbf1ecb58d70338e5aaaef02385a6ede707b9b78bbc90fac09d53c7460","graph_id":"schuss-graph-000002","revision":1,"status":"resolved"},"instrument_id":"schuss-instrument-000002","parameters":[{"default":"0.5","display_label":"Blend","domain":{"maximum":"1","minimum":"0","unit":"normalized"},"facet_id":"instrument-parameter-000001","update_behavior":{"smoothing_responsibility":"instrument","stateful":true,"update_kind":"runtime"},"value_type":"exact-decimal"}],"revision":3,"schema_version":"instrument-v0","state_declarations":[{"display_label":"Pickup Armed","persistence":"volatile","reset_policy":"default-on-start","state_id":"instrument-state-000001","value_kind":"boolean"}]}
